text,sentiment_label,sentiment_score,lang,is_ai,emoji_presence,keyword_score,clarity,sent_richness,relevance_score
"the popularity of word salad prepared by large language models (llms) like openais chatgpt, googles bard, and metas llama has prompted academics to look for ways to detect machinegenerated text. sadly, existing detection schemes may not be much bet",negative,0.5181,en,TRUE,0,7,1,0.974358974,3.894871795
"microsoft copilot is generative artificial intelligence (ai) technology based on gpt4, a large language model (llm) created by openai. it is also the basis for the wildly popular chatgpt chatbot.",neutral,0.7446,en,TRUE,0,7,1,0.933333333,3.886666667
"charl joseph vanessa (usa ) [actress vanessa hudgens charl joseph group of companies] chatgpt or chat generative pretrained transformer, is an ai chatbot created by openai. it is a large language model (llm), trained on massive amounts of language data to accurately predict",neutral,0.9505,en,TRUE,0,7,1,0.860465116,3.872093023
"how many people are now renting aws gpu instances so they can run stable diffusion to generate ai art, or running large language models, etc. how much demand is there from bing, chatgpt, bard, facebook, etc? pe looks insane but if revs 2x in a couple years, maybe not.",neutral,0.7539,en,TRUE,0,6,1,0.979591837,3.395918367
"you know what ai said may not be the best answer and yet many are using artificial intelligence like openais chatgpt, googles bard, or bing ai, to define their answers to top interview questions. well,…",negative,0.5156,en,TRUE,0,6,1,0.971428571,3.394285714
khan academy: are you curious about all the hype surrounding artificial intelligence (ai) and large language models (llms) like chatgpt? wondering if this new technology can help you in your learning journey?,positive,0.5426,en,TRUE,0,6,1,0.96875,3.39375
"openai is unveiling gpt4, the muchanticipated successor to an artificial intelligence tool that spawned viral services like chatgpt and the dalle imagecreation program",neutral,0.6813,en,TRUE,0,6,1,0.956521739,3.391304348
"ai was a hot topic this year greg brockman, cofounder of openai, the company behind chatgpt and dalle, talked about how he thinks artificial intelligence will revolutionize everything from writing to entertainment to the way we do our jobs.",positive,0.7477,en,TRUE,0,6,1,0.948717949,3.38974359
"call for speakersrocky mountain artificial intelligence interest group is looking for speakers for our monthly meetings. ai experts and lead users of chatgpt, dalle, midjourney, microsoft’s bing with chat, and google’s bard are welcome to contact us.",neutral,0.7525,en,TRUE,0,6,1,0.918918919,3.383783784
"openai is unveiling the successor to an artificial intelligence tool that spawned viral services chatgpt and dalle, and set off an intense competition among technology companies in the area known as generative ai. know more:",neutral,0.6959,en,TRUE,0,6,1,0.914285714,3.382857143
chatgpt a large language model developed by openai based on the gpt3.5 architecture. it uses artificial intelligence and natural language processing to understand and generate humanlike responses to questions or prompts.,neutral,0.8775,en,TRUE,0,6,1,0.903225806,3.380645161
"google releases bard: what to know about search giants new ai chatbot: google on march began to release its muchanticipated artificial intelligence chatbot, bard. it is the companys answer to chatgpt, a platform developed by openai, and to another…",neutral,0.5932,en,TRUE,0,6,1,0.897435897,3.379487179
chatgpt is an artificial intelligence chatbot developed by openai and launched in november 2022. it is built on top of openais gpt3 family of large language models and has been finetuned using both supervised and reinforcement learning techniques. 1/2,neutral,0.7963,en,TRUE,0,6,1,0.897435897,3.379487179
chatgpt is an artificial intelligence chatbot developed by openai and launched in november 2022. it is built on top of openais gpt3 and gpt4 families of large language models and has been finetuned (an approach to transfer learning),neutral,0.7537,en,TRUE,0,6,1,0.894736842,3.378947368
chatgpt is an artificial intelligence chatbot developed by openai . it is built on top of openais gpt3.5 and gpt4 families of large language models and has been finetuned using both supervised and reinforcement learning techniques.,neutral,0.8337,en,TRUE,0,6,1,0.888888889,3.377777778
"openais latest ""large language model"" artificial intelligence software, gpt4 5, can handle more than 64,00 words, compared to the maximum of gpt3 5s maximum of 8,00. the software is based on the companys groundbreaking chatgpt chatbo",neutral,0.5003,en,TRUE,0,6,1,0.888888889,3.377777778
"google is now offering bard – its chatdriven rival to chatgpt – to carefully selected netizens in the us and uk. bard, derived from the web advertising giants large language model lamda, was built to compete with openais gpt series, the brains behin",neutral,0.747,en,TRUE,0,6,1,0.88372093,3.376744186
"thread: unlock the power of gpt &amp; llms 1/ as a huge fan of chatgpt, i am thrilled to share my insights on how to make the most out of generative pretrained transformers (gpt) and large language models (llms) in this thread. get ready for the future of ai!",positive,0.9832,en,TRUE,0,6,1,0.87755102,3.375510204
"according to openai, the company behind chatgpt and its latest version, this newest version of the llm (large language model) is capable of reading photos and explaining their contents to users.",neutral,0.7612,en,TRUE,0,6,1,0.870967742,3.374193548
chatgpt[a] is an artificial intelligence chatbot developed by openai and launched in november 2022. it is built on top of openais gpt3 and gpt4 families of large language models and has been finetuned and the us ceo talking about the software listen to him.,neutral,0.787,en,TRUE,0,6,1,0.863636364,3.372727273
"whatever the ai powers of the latest large language models, i must say silicon valley is not great with names compared to china. chatgpt is really not a name at all. and bard? palm, llama, and even llms, are all trying to play on l and m. on the other hand, baidu has 文心一言.",negative,0.8258,en,TRUE,0,6,1,0.851851852,3.37037037
openai has announced the launch of its latest language model artificial intelligence tool in gpt4 that has brought together key functions of chatgpt and dalle. it can accept text and image inputs but its outputs will be in text only.,neutral,0.5436,en,TRUE,0,6,1,0.85,3.37
2/n 1. amazon will come out with a competitor to openais chatgpt or googles bard soon. 2. amazon/microsoft/google will put their respective llm into their respective smart home device (or microsoft will come up with one and start it off with chatgpt),neutral,0.8377,en,TRUE,0,6,1,0.833333333,3.366666667
"google is currently at war with openai and its powerful ai tools. while dalle is pretty scary, it’s chatgpt that has google up in arms. now, google bard, the company’s answer to chatgpt, is hitting the public, and you can sign up for the waitlist today. w",neutral,0.4646,en,TRUE,0,6,1,0.829787234,3.365957447
gpt4 is an artificial intelligence model developed by openai. it is based on the generative pretrained transformer 3.5 architecture. it is the latest iteration of the chatgpt series.,neutral,0.8402,en,TRUE,0,6,1,0.821428571,3.364285714
"bard: chatgpt is a large language model (llm) chatbot developed by google ai. it is trained on a massive dataset of text and code, and can generate text, translate languages, and write different kinds of creative content. chatgpt is a powerful tool, but it can also be used to…",neutral,0.5911,en,TRUE,0,6,1,0.795918367,3.359183673
"the article discusses the rise of openai’s chatgpt, a large language model that can generate convincing, detailed responses to natural language requests. the article highlights the importance of understanding the nature and limitations of llms before trusting them.",neutral,0.5838,en,TRUE,0,6,1,0.789473684,3.357894737
"openai founder talks chatgpt, dalle and whats next for artificial intelligence at sxsw",neutral,0.8235,en,TRUE,0,6,0.65,1,3.33
"(took metas llama, and trained it to answer questions in the style of chatgpt using openais textdavinci003) big week for ai monday: stanford releases alpaca 7b google announces medpalm a new medical llm",neutral,0.5648,en,TRUE,0,5,1,1,2.9
"openai ceo sam altman has cautioned that his companys artificial intelligence technology, chatgpt, poses serious risks as it reshapes society. find out more at",neutral,0.6482,en,TRUE,0,5,1,1,2.9
"chatgpt is a chatbotstyle technology trained on large language models (llms) capable of producing essays, poems, lyrics, news articles and even computer programs.",neutral,0.8812,en,TRUE,0,5,1,1,2.9
"bill gates: artifical intelligence ai, as shown by openais gpt4, chatgpt, and newly released google bard, is the most important tech advance in decades",positive,0.9532,en,TRUE,0,5,1,1,2.9
openai seems to have a crazy moat around. not optimistic on bard given that the bing chatbot is potentially worse than native chatgpt which has no internet access.,negative,0.9055,en,TRUE,0,5,1,1,2.9
summary: google opens their own ai chatbot called bard as a result of the evergrowing chatgpt technology started by openai.,neutral,0.8102,en,TRUE,0,5,1,1,2.9
"generative artificial intelligence has become a buzzword this year, with openais chatgpt being among the most famous examples. heres what you need to know about it. |",positive,0.7638,en,TRUE,0,5,1,1,2.9
"artificial intelligence is advancing at an unprecedented pace, and openai ceo sam altmans admission that chatgpt can eliminate human jobs highlights the need for responsible ai development.",positive,0.5337,en,TRUE,0,5,1,1,2.9
"1/hey everyone! definitely you ve heard about chatgpt. its a large language model created by openai, based on the gpt3.5 architecture but many people still dont know how to use it so i wrote this thread for beginners :",neutral,0.815,en,TRUE,0,5,1,1,2.9
"news. google releases bard, an ai chatbot entering the market to compete with openais chatgpt and microsoft bing chat. via",neutral,0.8352,en,TRUE,0,5,1,1,2.9
"after integrating chatgpt into bing, microsoft is adding a tool to it, that creates images from words using an advanced version of openais dalle model.",neutral,0.8566,en,TRUE,0,5,1,1,2.9
"stanfords center for research on foundation models announced that its researchers had ""finetuned"" meta’s llama 7b large language model (llm) using openais gpt api",neutral,0.8892,en,TRUE,0,5,1,1,2.9
chatgpt artificial intelligence chatbot developed by openai. another left propaganda machine. b.s. check out the comparison of trump vs. obama.,negative,0.8527,en,TRUE,0,5,1,1,2.9
"some law professor colleagues and i are writing about whether large language model creators (e.g., openai, the creator of chatgpt4) """,neutral,0.9038,en,TRUE,0,5,1,1,2.9
"too cheap for midjourney since i write a free newsletter so cant expense it. instead, its notion ai, chatgpt, dalle 2, and stable diffusion.",neutral,0.6434,en,TRUE,0,5,1,1,2.9
"(not) fun ai fact: while not able to enter openai chatgpt4 (even though im a paid user) today, at least i can start experimenting with google bard for scoretize",neutral,0.4309,en,TRUE,0,5,1,1,2.9
"on tuesday, anthropic introduced claude, a large language model (llm) that can generate text, write code, and function as an ai assistant similar to chatgpt. 1/2",neutral,0.7956,en,TRUE,0,5,1,1,2.9
openai’s wellknown artificial intelligence (ai) chatbot chatgpt is said to have stopped working for its users all over the world after a number of complaints were filed with health monitor down detector. read story:,negative,0.7448,en,TRUE,0,5,1,1,2.9
chatgpt is an artificial intelligence (ai)powered natural language processing (nlp) application developed by openai that generates humanlike text answers in realtime.,neutral,0.8581,en,TRUE,0,5,1,1,2.9
"google bard laid an egg on this request: ""provide movie recommendations that have artificial intelligence as a major plot point. include imdb urls with each result."" chatgpt and 3.5 performed just fine.",positive,0.7369,en,TRUE,0,5,1,1,2.9
people are already using chatgpt to create workout plans: fitness advice from openai’s large language model is impressively presented but don’t take it too seriously. via,neutral,0.7351,en,TRUE,0,5,1,1,2.9
"after chatgpt, openai brought everyones attention to another large language model: gpt4. it now takes visual inputs and performs very well in many standardized tests (e.g., bar exam, gre). read this article from openai about gpt4:",positive,0.9088,en,TRUE,0,5,1,0.972222222,2.894444444
"digital trends may earn a commission when you buy through links on our site. it’s made by openai, wellknown for having developed the texttoimage generator dalle. the basic version of chatgpt is completely free to use.",positive,0.6135,en,TRUE,0,5,1,0.972222222,2.894444444
"save time and enhance your product design process with chatgpt! this language model can generate content, power conversational interfaces, and personalize user experiences. try openais gpt3 api or hugging faces transformers library to get started.",positive,0.889,en,TRUE,0,5,1,0.971428571,2.894285714
"everybodys talking about chatgpt, but have you heard of dalle 2? its the latest version of openais image generation system that can create amazing images from textual descriptions. lets explore what makes it so impressive.",positive,0.9432,en,TRUE,0,5,1,0.971428571,2.894285714
"anthropic, an ai company backed by alphabet, released a large language model that competes directly with chatgpt its startup cofounded by dario &amp; daniela amodei, both of whom are exopenai employees . credit : anthropic",neutral,0.6064,en,TRUE,0,5,1,0.971428571,2.894285714
"chatgpt responds to queries in a humanlike, conversational language with a great deal of accuracy. it’s been less than four months since openai announced chatgpt, the generative artificial intelligencebased chatbot that has already taken",positive,0.8612,en,TRUE,0,5,1,0.970588235,2.894117647
"it’s been a mere four months since artificial intelligence company openai unleashed chatgpt. in just short weeks, it has sparked doomsday predictions in global job markets, disrupted education systems, and drawn millions of users.",negative,0.4908,en,TRUE,0,5,1,0.970588235,2.894117647
"the artificial intelligence research lab openai has released gpt4, ai system that powers chatgpt, which it says is more creative, less likely to make up facts, and less biased than its predecessor. read more:",neutral,0.6235,en,TRUE,0,5,1,0.970588235,2.894117647
"artificial intelligence software like openais chatgpt is driving demand for prompt engineers. prompt engineers dont really use coding languages, but specialize in crafting detailed prompts. theyre being hired by companies to improve the",neutral,0.6367,en,TRUE,0,5,1,0.96969697,2.893939394
"breaking openais chatgpt artificial intelligence program has passed the bar exam in the top 10%. lets hope asimovs laws are hardcoded into every subroutine, but if is involved, i doubt it. scary stuff.",negative,0.4816,en,TRUE,0,5,1,0.96969697,2.893939394
"what happens when you let an ai chatbot create a beer recipe? atwater brewery in detroit found out with their new artificial intelligence ipa, using a recipe fully generated by openais chatgpt.",neutral,0.8317,en,TRUE,0,5,1,0.96875,2.89375
"‘we are a little bit scared’: openai ceo (behind chatgpt) warns of risks of artificial intelligence, cites disinformation as an example. also notes that gpt4 is “reasoning engine’ not “fact database”",negative,0.6583,en,TRUE,0,5,1,0.967741935,2.893548387
do you think gpt4 is bigger and better than get an inside look into openais new large language model and explore the areas where it plans to out perform chatgpt. (cc:,neutral,0.666,en,TRUE,0,5,1,0.967741935,2.893548387
"employees are submitting sensitive business data and privacyprotected information to large language models (llms) such as chatgpt, raising concerns that ai services could be incorporating the data into their models.",neutral,0.6428,en,TRUE,0,5,1,0.966666667,2.893333333
"right now, major tech firms are clamouring to replicate the runaway success of chatgpt, the generative ai chatbot developed by openai using its gpt3 large language model. explains in detail:",positive,0.7908,en,TRUE,0,5,1,0.966666667,2.893333333
"generative ai like chatgpt and google bard are trained on publicly available data, but what will it take to build an llm that truly understands us? intriguing discussion between and",neutral,0.7843,en,TRUE,0,5,1,0.966666667,2.893333333
"content generated by artificial intelligence including ai writers like chatgpt and imagegenerating tools like dalle can now be copyrighted if they meet certain criteria, according to the us copyright office.",neutral,0.9233,en,TRUE,0,5,1,0.966666667,2.893333333
"built a thing over the past few weekends, and i find it quite useful on my phone. allows you to effortlessly utilize openais chatgpt and dalle via text messaging.",positive,0.9109,en,TRUE,0,5,1,0.965517241,2.893103448
"former openai employees have launched a competitor, chatgpt. they introduced a chatgpt competitor called claude. chatbot claude was created by the developers of anthropic, which deals with artificial intelligence.",neutral,0.8895,en,TRUE,0,5,1,0.965517241,2.893103448
"the future is here, and its a beer called artificial intelligence ipa. atwater brewery has teamed up with openais chatgpt to create a unique recipe for their latest brew.",positive,0.8514,en,TRUE,0,5,1,0.965517241,2.893103448
"british intelligence agency warns of dangers posed by ai chatbots large language models (llms) like chatgpt have raised concerns about the security implications, according to the ncsc tech directors.",negative,0.5653,en,TRUE,0,5,1,0.965517241,2.893103448
"my dungeon shakes with delight as another ai chatbot, bard, is released by google to join openais chatgpt and microsoft bing chat! let the battle of the algorithms begin!",positive,0.9546,en,TRUE,0,5,1,0.965517241,2.893103448
"hear that buzz? it’s people talking about artificial intelligence, and more specifically, the openai “chatbot” known as chatgpt. my march newsletter gathers expert opinions on using or not using",neutral,0.8092,en,TRUE,0,5,1,0.965517241,2.893103448
", announced that the pyramid release will expand its already categoryleading, aidriven augmented capabilities by integrating gpt ai technology from openai, the company behind chatgpt and dalle 2.",positive,0.5503,en,TRUE,0,5,1,0.964285714,2.892857143
"were excited to share the big news! interplay now includes integrations with stable diffusion, chatgpt, and other openai tools across the fastmoving generative ai landscape. read more here:",positive,0.9717,en,TRUE,0,5,1,0.964285714,2.892857143
"openai s chatgpt an artificial intelligence powered chatbot has been used by amateurs for myriad reasons, from writing assignments and fake movie scenarios to sermons and scripts.",neutral,0.5196,en,TRUE,0,5,1,0.962962963,2.892592593
"releases bard, an ai chatbot entering the market to compete with openais chatgpt and microsoft bing chat. you can sign up to try bard at",neutral,0.8439,en,TRUE,0,5,1,0.96,2.892
"“if asked to name the best chatgpt alternatives, there are several options to consider” google bard microsoft bing chatsonic jasper chat openai playground follow",neutral,0.7455,en,TRUE,0,5,1,0.958333333,2.891666667
"google bard, a new chatbot tool, was introduced in response to competing artificial intelligence (ai) platforms like chatgpt. read here to know more!",neutral,0.7128,en,TRUE,0,5,1,0.956521739,2.891304348
it’s been four months since artificial intelligence company openai unleashed chatgpt and — not to overstate its importance — changed the world forever.,positive,0.88,en,TRUE,0,5,1,0.956521739,2.891304348
"openai has announced gpt4, the latest version of its large language model that powers key applications like chatgpt and the new bing.",positive,0.56,en,TRUE,0,5,1,0.954545455,2.890909091
"science &amp; tech | microsoft adds ai tools to office apps like outlook, word . in this file photo taken in toulouse, southwestern france, shows screens displaying the logos of microsoft and chatgpt, a conversational artificial intelligence application software developed by openai.",neutral,0.7043,en,TRUE,0,5,1,0.952380952,2.89047619
"google’s bard lags behind gpt4 and claude in headtohead comparison: google has taken the wraps off bard, its conversational ai meant to compete with chatgpt and other large language models. but after its shaky debut, users may understandably be a bit…",negative,0.6234,en,TRUE,0,5,1,0.951219512,2.890243902
"an alternative perspective: identify domains where transformer llms are likely to be poorly trained (for now, at least). ive repeatedly tried to get chatgpt to design a 16way setassociative cache controller in systemverilog. it sure tries and then chokes every time.",negative,0.7402,en,TRUE,0,5,1,0.951219512,2.890243902
google has more to lose if bard goes off the rails than microsoft/openai does it bing or chatgpt do,negative,0.793,en,TRUE,0,5,0.95,1,2.89
"in february 2023, cocacola announced that it’d be collaborating with openai’s dalle2 model and chatgpt for marketing campaigns. (1/3)",neutral,0.8843,en,TRUE,0,5,0.95,1,2.89
"google releases bard, an ai chatbot entering the market to compete with openais chatgpt and microsoft bing chat. via",neutral,0.8035,en,TRUE,0,5,0.95,1,2.89
stanford alpaca llm only cost $600 to produce chatgpt 3.5 level results. someone explain to me what moat openai has?,neutral,0.4865,en,TRUE,0,5,1,0.95,2.89
"openai released its a chatbot chatgpt to the public in late november, and this week it unveiled a more capable successor called gpt4. openai ceo sam altman believes artificial intelligence has incredible upside for society, but he also wor",positive,0.8675,en,TRUE,0,5,1,0.948717949,2.88974359
"i welcome openai, chatgpt. this is a great tool that can help humans in many ways. though it is evident we also need rapid research and regulation of the use of llms by corporations, new disclosure standards etc.",positive,0.9351,en,TRUE,0,5,1,0.947368421,2.889473684
"i’m reading through the research paper published by openai today about the labor market impact of llms. basically, is chatgpt going to take your job? i’ll share some findings in this thread as i read through it.",neutral,0.9022,en,TRUE,0,5,1,0.945945946,2.889189189
"it is no wonder elon is trying to raise doubts about chatbots and ai. he lost his chief autodrive engineer to openai. andrej karpathy, tesla’s director of artificial intelligence,left for openai, the company behind languagemodeling software chatgpt.",negative,0.8086,en,TRUE,0,5,1,0.945945946,2.889189189
"chatgpt has already exceeded million users in less than days from launch. openais chatbot almost wasnt released. stable diffusions image generation model has been used on pop music videos, hollywood movies and by more than 1…",neutral,0.5869,en,TRUE,0,5,1,0.944444444,2.888888889
"now, the newest version of this model, chatgpt4 release date is set to be soon. openai chatgpt, a powerful language model that can generate humanlike responses, has been making waves in the world of artificial intelligence.",positive,0.8657,en,TRUE,0,5,1,0.944444444,2.888888889
"(mashable EMO_NEG is down, even for paying plus subscribers : it looks like artificial intelligence hasnt yet solved the ageold problem of a website or online service going down. openais popular chatgpt is currently facing a",negative,0.9112,en,TRUE,0,5,1,0.944444444,2.888888889
tasks were chosen last year to test the ability of various large language models (llms) the computational engines behind ai chatbots such as chatgpt. the most complex model nailed it in one guess: finding nemo.,neutral,0.5665,en,TRUE,0,5,1,0.942857143,2.888571429
how intelligent enterprise software is transforming business processes: between openai’s research release of its language model chatgpt and microsoft’s inclusion of an embedded (and still improving) artificial intelligence (ai) chatbot in its bing search…,neutral,0.5761,en,TRUE,0,5,1,0.941176471,2.888235294
"google officially releases bard, its chatgpt rival as the ai war in silicon valley heats up, the worlds biggest search engine is starting a beta test of its own large language model chatbot.",positive,0.6007,en,TRUE,0,5,1,0.939393939,2.887878788
"literally all google needs to do to take a large chunk of openai their customers, is release bard with less censorship chatgpt now feels like youre using a parental control version for age and under. as an ai language model i can not blah blah blah, (insert lecture)",negative,0.8495,en,TRUE,0,5,1,0.9375,2.8875
"a groundbreaking natural language processing model called chat gpt, also known as the generative pretrained transformer, was created by openai and has been causing a stir in the ai industry. enter: chatgpt",positive,0.6964,en,TRUE,0,5,1,0.9375,2.8875
"most hear artificial intelligence and they think 2023, that the trend started with openai gpt3, now 4. stop to wonder about chatgpt &amp; 1, how long they’ve been around tested by a select few for years in the open or how other companies exist and evil ones too?",neutral,0.5565,en,TRUE,0,5,1,0.9375,2.8875
